{
  "$schema": "https://json-schema.org/draft/2020-12/schema",
  "$id": "https://driftframe.example/contracts/promotion-observation.v1.schema.json",
  "title": "Enterprise Implementation Promotion Observation v1",
  "type": "object",
  "additionalProperties": false,
  "required": [
    "$schema",
    "schema_version",
    "promotion_receipt_id",
    "repository",
    "target_release",
    "promotion_state",
    "evidence_mode",
    "assurance_stage",
    "candidate_coordinate",
    "release_coordinate",
    "required_evidence",
    "limitations",
    "accountable_role",
    "metadata"
  ],
  "properties": {
    "$schema": {
      "const": "../contracts/promotion-observation.v1.schema.json"
    },
    "schema_version": {
      "const": "1.0.0"
    },
    "promotion_receipt_id": {
      "const": "RCP-IMPLEMENTATION-PROMOTION-004"
    },
    "repository": {
      "const": "driftframestudios/lims-eln-enterprise-implementation"
    },
    "target_release": {
      "const": "v0.3.2"
    },
    "promotion_state": {
      "const": "release_observed"
    },
    "evidence_mode": {
      "const": "observed"
    },
    "assurance_stage": {
      "const": "verified"
    },
    "candidate_coordinate": {
      "$ref": "#/$defs/candidateCoordinate"
    },
    "release_coordinate": {
      "$ref": "#/$defs/releaseCoordinate"
    },
    "required_evidence": {
      "$ref": "#/$defs/materialStatements"
    },
    "limitations": {
      "$ref": "#/$defs/materialStatements"
    },
    "accountable_role": {
      "const": "Implementation release stewardship"
    },
    "metadata": {
      "$ref": "#/$defs/metadata"
    }
  },
  "$defs": {
    "sha1Oid": {
      "type": "string",
      "pattern": "^(?!0{40}$)[a-f0-9]{40}$"
    },
    "sha256Digest": {
      "type": "string",
      "pattern": "^sha256:(?!0{64}$)[a-f0-9]{64}$"
    },
    "candidateCoordinate": {
      "type": "object",
      "additionalProperties": false,
      "required": [
        "release",
        "commit_oid",
        "tree_oid",
        "candidate_receipt",
        "candidate_receipt_digest",
        "public_inspection_manifest_digest"
      ],
      "properties": {
        "release": {
          "const": "candidate-implementation-v0.3.2"
        },
        "commit_oid": {
          "const": "ce612ae3e4fcf6ff478f5d801343e8b28b4f847d"
        },
        "tree_oid": {
          "const": "eb8eadb27a9e07c6069a1946f115a0083d94af5c"
        },
        "candidate_receipt": {
          "const": "receipts/promotion-candidate.json"
        },
        "candidate_receipt_digest": {
          "const": "sha256:c78f16df5832f6c7b39ea1b0d9a61316b26d90cd1552fd8b2c39043436a94340"
        },
        "public_inspection_manifest_digest": {
          "const": "sha256:73a062069301c694df26196a7384184d7229089885d97279cb989244ca7435c8"
        }
      }
    },
    "hostedCheck": {
      "type": "object",
      "additionalProperties": false,
      "required": [
        "name",
        "run_id",
        "job_id",
        "conclusion"
      ],
      "properties": {
        "name": {
          "const": "Repository validation"
        },
        "run_id": {
          "const": "33623991109"
        },
        "job_id": {
          "const": "100227324662"
        },
        "conclusion": {
          "const": "success"
        }
      }
    },
    "reviewObservation": {
      "type": "object",
      "additionalProperties": false,
      "required": [
        "merge_admission",
        "independent_review",
        "github_review_record"
      ],
      "properties": {
        "merge_admission": {
          "const": "configured_ordinary_bypass"
        },
        "independent_review": {
          "const": "deputized_independent_review_completed"
        },
        "github_review_record": {
          "const": "no_formal_review_submitted"
        }
      }
    },
    "releaseCoordinate": {
      "type": "object",
      "additionalProperties": false,
      "required": [
        "git_object_format",
        "tag",
        "tag_object_oid",
        "commit_oid",
        "tree_oid",
        "archive_format",
        "archive_digest",
        "promoted_at",
        "pull_request",
        "hosted_checks",
        "review_observation",
        "merge_signature_verification",
        "tag_signature_verification"
      ],
      "properties": {
        "git_object_format": {
          "const": "sha1"
        },
        "tag": {
          "const": "v0.3.2"
        },
        "tag_object_oid": {
          "const": "c3db01079b88622f06e8714c8bcbdf0dc1803a10"
        },
        "commit_oid": {
          "const": "fe0bd2a08ac1697ce18ca583d9631faae7db7132"
        },
        "tree_oid": {
          "const": "eb8eadb27a9e07c6069a1946f115a0083d94af5c"
        },
        "archive_format": {
          "const": "git-tar"
        },
        "archive_digest": {
          "const": "sha256:0ea3db3099e3485f65d238fb2e194c6bfd9b9a90f6642431c4a96974ebcc3c16"
        },
        "promoted_at": {
          "const": "2026-09-02T11:21:02Z"
        },
        "pull_request": {
          "const": 27
        },
        "hosted_checks": {
          "type": "array",
          "prefixItems": [
            {
              "$ref": "#/$defs/hostedCheck"
            }
          ],
          "minItems": 1,
          "maxItems": 1
        },
        "review_observation": {
          "$ref": "#/$defs/reviewObservation"
        },
        "merge_signature_verification": {
          "const": "valid"
        },
        "tag_signature_verification": {
          "const": "valid"
        }
      }
    },
    "materialStatements": {
      "type": "array",
      "minItems": 1,
      "uniqueItems": true,
      "items": {
        "type": "string",
        "minLength": 20
      }
    },
    "metadata": {
      "type": "object",
      "additionalProperties": false,
      "required": [
        "schema_version",
        "created_at",
        "updated_at",
        "owner"
      ],
      "properties": {
        "schema_version": {
          "const": "1.0.0"
        },
        "created_at": {
          "const": "2026-09-02T11:23:40Z"
        },
        "updated_at": {
          "const": "2026-09-02T11:23:40Z"
        },
        "owner": {
          "type": "object",
          "additionalProperties": false,
          "required": [
            "actor_id",
            "display_name",
            "role"
          ],
          "properties": {
            "actor_id": {
              "const": "OWNER-IMPLEMENTATION-PROMOTION-004"
            },
            "display_name": {
              "const": "Implementation release stewardship role"
            },
            "role": {
              "const": "Promotion observation owner"
            }
          }
        }
      }
    }
  }
}
